title,author,published_date,published_date_precision,link,clean_url,excerpt,summary,rights,rank,topic,country,language,authors,media,is_opinion,twitter_account,_score,_id
«Βιολογικά όπλα»: Για θεωρίες συνωμοσίας κατηγορεί τη Ρωσία η Δύση,Parapolitika Newsroom,2022-03-13 07:15:28,full,https://www.parapolitika.gr/diethni/article/1175941/viologika-opla-gia-theories-sunomosias-katigorei-ti-rosia-i-dusi-aprothumos-na-termatisei-ton-polemo-o-rosos-proedros,parapolitika.gr,Οι χώρες της Δύσης κατηγόρησαν τη Ρωσία στο Συμβούλιο Ασφαλείας του ΟΗΕ ότι διαδίδει «ανεύθυνους μύθους συνωμοσίας»,"Για 18η ημέρα συνεχίζονται οι εχθροπραξίες στην Ουκρανία , με το Κίεβο να είναι περικυκλωμένο, την ώρα που η Ρωσία βομβαρδίζει μεγάλες πόλεις. Οι χώρες της Δύσης κατηγόρησαν τη Ρωσία στο Συμβούλιο Ασφαλείας του ΟΗΕ ότι διαδίδει «ανεύθυνους μύθους συνωμοσίας» σχετικά με τα υποτιθέμενα βιολογικά όπλα στην Ουκρανία. Υπενθυμίζεται ότι η Ρωσία είχε συγκαλέσει το Συμβούλιο Ασφαλείας του ΟΗΕ ισχυριζόμενη ότι η Ουκρανία έχει βιολογικά όπλα. Στη συνεδρίαση ο Ρώσος πρέσβης, Βασίλι Νεμπένσια, δέχθηκε σφοδρή επίθεση, από την πρέσβη της Βρετανίας στον ΟΗΕ, Μπάρμπαρα Γούντγουορντ, η οποία δήλωσε ότι η Ρωσία ζήτησε τη συνάντηση για τα υποτιθέμενα βιολογικά όπλα στην Ουκρανία, μόνο για να εκφράσει «μια σειρά από εντελώς αβάσιμες και ανεύθυνες θεωρίες συνωμοσίας».",parapolitika.gr,106597,news,GR,el,['Parapolitika Newsroom'],https://s.parapolitika.gr/images/640x360/files/2022-03-13/Σχεδιο_χωρις_τιτλο_-_2022-03-13T091450_593.png,False,,27.3889,78ca84205fd3a7182250165e01273458
Βλαντιμίρ Πούτιν: Η θεωρία συνωμοσίας του QAnon και τα βιολογικά όπλα,,2022-03-14 05:48:00,full,https://newpost.gr/kosmos/622ed791eb06f7040bb321e6/vlantimir-poytin-i-theoria-synomosias-toy-qanon-kai-ta-viologika-opla-poios-o-rolos-toy-tramp,newpost.gr,Η βασική «προφητεία» του QAnon είναι ότι υπήρχε πάντα ένα σχέδιο και ο πρώην πρόεδρος Ντόναλντ Τραμπ θα έσωζε τον πλανήτη από μια σατανική ομάδα που θέλει να ελέγξει τον κόσμο.,"Για να δικαιολογήσει την εισβολή στην Ουκρανία το Κρεμλίνο χρησιμοποιεί μια θεωρία συνωμοσίας που είναι δημοφιλής και κυκλοφορεί εδώ και λίγο καιρό στους κύκλους του QAnon.
Σύμφωνα με το CNN, ότι οι ΗΠΑ αναπτύσσουν βιολογικά όπλα στην Ουκρανία, αναγκάζοντας τον Βλαντίμιρ Πούτιν να επέμβει και να σώσει τον κόσμο, καταστρέφοντάς τα.
Η σύνδεση με τον Τραμπ
Η βασική «προφητεία» του QAnon είναι ότι υπήρχε πάντα ένα σχέδιο και ο πρώην πρόεδρος Ντόναλντ Τραμπ θα έσωζε τον πλανήτη από μια σατανική ομάδα που θέλει να ελέγξει τον κόσμο.",newpost.gr,85676,news,GR,el,[],https://newpost.gr/watermark/202203/k6mzfg1647005349974.jpg,False,@newpost.gr,29.196812,193eaad0cdcf897b84651b212f93a8d7
Ρωσικές Αρχές: «H Ουκρανία θα στείλει μολυσμένα πουλιά ως βιολογικά όπλα»,,2022-03-14 12:45:00,full,https://www.koutipandoras.gr/article/oi-ishyrismoi-tis-rosias-gia-ta-biologika-opla-stin-oykrania-oi-antifatikes-antidraseis-apo,koutipandoras.gr,"Τα «επικίνδυνα» παθογόνα στα βιολογικά εργαστήρια της Ουκρανίας - Ο Κονασένκοφ κάνει λόγο για «αμερικανικό σχέδιο», σχετικό με «μεταφορά παραγόντων παθογένειας από άγρια αποδημητικά πτηνά ανάμεσα στην…","Η Ρωσία διατείνεται πως υπάρχει δίκτυο εργαστηρίων έρευνας και ανάπτυξης βιολογικών όπλων που λειτουργούσε για λογαριασμό του αμερικανικού Πενταγώνου στο έδαφος της Ουκρανίας. Πρόκειται για έναν ισχυρισμό που έχει διαψευστεί επανειλημμένα, ωστόσο σύμφωνα πάντα με το ρωσικό υπουργείο Άμυνας, όλα τα αποδεικτικά στοιχεία έχουν καταστραφεί προκειμένου να διατηρηθεί μυστικό το εξοπλιστικό πρόγραμμα της χώρας - O Κονασένκοφ κάνει λόγο για «αμερικανικό σχέδιο», σχετικό με «μεταφορά παραγόντων παθογένειας από άγρια αποδημητικά πτηνά ανάμεσα στην Ουκρανία και τη Ρωσία και άλλες γειτονικές χώρες» - Τι λένε οι παγκόσμιοι οργανισμοί - Αντιφατικές αντιδράσεις από τις ΗΠΑ.",,155019,news,GR,el,[],https://www.koutipandoras.gr/sites/default/files/styles/rocket_original/public/2022-03/pexels-somya-dinkar-3401967.jpg?itok=gQp6_TGY,False,@Kouti_Pandoras,28.644857,51bbd9b91a8f6216e2b891de408ed3fd
Η Κίνα ζητά απάντηση από τις ΗΠΑ για τα βιολογικά εργαστήρια στην Ουκρανία,Συντακτική ομάδα ert.gr,2022-03-14 17:43:49,full,https://www.ertnews.gr/eidiseis/diethni/i-kina-zita-apantisi-apo-tis-ipa-gia-ta-viologika-ergastiria-stin-oykrania,ertnews.gr,"Οι κινεζικές αρχές κάλεσαν τις Ηνωμένες Πολιτείες να επιδείξουν διαφάνεια όσον αφορά τα βιολογικά εργαστήρια που ανακαλύφθηκαν πρόσφατα στην Ουκρανία,","O εκπρόσωπος Τύπου του κινεζικού Υπ.Εξ. Ζάο Λιτζιάν — AP PhotoΟι κινεζικές αρχές κάλεσαν τις Ηνωμένες Πολιτείες να επιδείξουν διαφάνεια όσον αφορά τα βιολογικά εργαστήρια που ανακαλύφθηκαν πρόσφατα στην Ουκρανία, δήλωσε ο εκπρόσωπος του κινεζικού υπουργείου Εξωτερικών, Zhao Lidjen. «Η στρατιωτική-βιολογική δραστηριότητα στην Ουκρανία έχει σημάνει συναγερμό σε ολόκληρη την παγκόσμια κοινότητα», επέμεινε ο διπλωμάτης, όπως μετέδωσε το ρωσικό πρακτορείο TASS. Σύμφωνα με πρόσφατα δημοσιευμένα στοιχεία, «υπάρχουν δεκάδες βιοεργαστήρια στην Ουκρανία που λειτουργούν σύμφωνα με τις οδηγίες του αμερικανικού Υπουργείου Άμυνας», είπε ο Lidjen, τονίζοντας ότι «οι Ηνωμένες Πολιτείες διοχέτευσαν περισσότερα από 200 εκατομμύρια δολάρια σε αυτά τα εργαστήρια», ανέφερε το Tanjug.",ertnews.gr,397322,news,GR,el,['Συντακτική ομάδα ert.gr'],https://www.ertnews.gr/wp-content/uploads/2022/03/Chinese-Foreign-Ministry-spokesperson-Zhao-Lijian-AP-Photo.jpg,False,,28.594007,daac7cfb42199783955ed84afa042fa9
Η Κίνα απαιτεί εξηγήσεις από τις ΗΠΑ για τα βιολογικά εργαστήρια στην Ουκρανία!,Τρομπούκης Παναγιώτης,2022-03-14 21:36:48,full,https://www.newsbreak.gr/kosmos/308597/i-kina-apaitei-exigiseis-apo-tis-ipa-gia-ta-viologika-ergastiria-stin-oykrania,newsbreak.gr,"Στη προγραμματισμένη συνέντευξη Τύπου της Δευτέρας του κινεζικού υπουργείου Εξωτερικών, ο εκπρόσωπος του υπουργείου αντέκρουσε τις ασυνεπείς και λανθασμένες","Στη προγραμματισμένη συνέντευξη Τύπου της Δευτέρας του κινεζικού υπουργείου Εξωτερικών, ο εκπρόσωπος του υπουργείου αντέκρουσε τις ασυνεπείς και λανθασμένες απαντήσεις των ΗΠΑ σχετικά με τα βιολογικά τους εργαστήρια στην Ουκρανία, προτρέποντας για πλήρη διευκρίνιση των βιοστρατιωτικών δραστηριοτήτων εντός και εκτός των συνόρων τους. Είναι πλέον εμφανές ότι η Κίνα συνδέει τις αποκαλύψεις για τα βιολογικά εργαστήρια της Ουκρανίας που λειτουργούσαν με αμερικανική χρηματοδότηση, με το εργαστήριο της Γιουχάν από το οποίο φαίνεται να ξεκίνησε ο κορονοϊός.",newsbreak.gr,356620,news,GR,el,['Τρομπούκης Παναγιώτης'],https://www.newsbreak.gr/wp-content/uploads/2022/03/DBEE95D6-3440-41BD-8A78-4951BAB104D0.jpeg,False,@newsbreakGR,29.029352,30e4aa27cfd189517612d99a38a44af1
Προειδοποίηση Στόλτενμπεργκ: Η Ρωσία θα μπορούσε να στήνει προβοκάτσια με χημικά όπλα,,2022-03-15 15:26:00,full,https://newpost.gr/kosmos/6230b0ea1ea1fc4763f76f1f/proeidopoiisi-stoltenmpergk-i-rosia-tha-mporoyse-na-stinei-provokatsia-me-himika-opla,newpost.gr,Ο επικεφαλής του ΝΑΤΟ δήλωσε ότι η Ρωσία «προβάλλει παράλογους ισχυρισμούς για βιολογικά εργαστήρια και χημικά όπλα» στην Ουκρανία.,"Η Ρωσία θα μπορούσε να στήνει προβοκάτσια με χημικά όπλα στο πλαίσιο του πολέμου στην Ουκρανία, προειδοποίησε την Τρίτη σε συνέντευξη Τύπου του ο ΓΓ. του ΝΑΤΟ Γενς Στόλτενμπεργκ απηχώντας και τους φόβους άλλων ηγετών. 
Ο επικεφαλής του ΝΑΤΟ δήλωσε ότι η Ρωσία «προβάλλει παράλογους ισχυρισμούς για βιολογικά εργαστήρια και χημικά όπλα» στην Ουκρανία. «Αυτό είναι απλώς ένα ακόμη ψέμα», τόνισε, υπενθυμίζοντας ότι η Ρωσία είχε αρχικά δηλώσει ότι δεν σχεδίαζε να εισβάλει στην Ουκρανία. «Ανησυχούμε ότι η Μόσχα θα μπορούσε να πραγματοποιήσει μια προβοκάτσια, ενδεχομένως να περιλαμβάνει χημικά όπλα», λέει ο Στόλτενμπεργκ.",newpost.gr,85676,news,GR,el,[],https://newpost.gr/watermark/202202/dn5z6k61645104677670.jpeg,False,@newpost.gr,27.720615,bfad02ff87c874648cd2daddd2e604d6
Κίνα: διεθνής ανεξάρτητη έρευνα στα βιολογικά εργαστήρια στην Ουκρανία. Ρωσία: οι δράσεις των βιολογικών αυτών εργαστηρίων θανάσιμη απειλή γι ανθρωπότητα.,Δείτε όλα τα άρθρα του/της Κατοχικά Νέα →,2022-03-16 07:25:41,full,https://katohika.gr/diethni/kina-diethnis-aneksartiti-erevna-sta-viologika-ergastiria-stin-oukrania-rosia-oi-draseis-ton-viologikon-afton-ergastirion-thanasimi-apeili-gi-anthropotita,katohika.gr,Κίνα: διεθνής ανεξάρτητη έρευνα στα βιολογικά εργαστήρια στην Ουκρανία. Ρωσία: οι,"Κίνα: διεθνής ανεξάρτητη έρευνα στα βιολογικά εργαστήρια στην Ουκρανία. Ρωσία: οι δράσεις των βιολογικών αυτών εργαστηρίων θανάσιμη απειλή γι ανθρωπότητα. Δεν μπορούσαμε να επιτρέψουμε ανάπτυξη πυρηνικών όπλων από Ουκρανία..
Η Ρωσία δεν μπορούσε να επιτρέψει στην Ουκρανία να δημιουργήσει πυρηνικά όπλα που θα απειλούσαν την ασφάλεια όλου του κόσμου δήλωσε ο Γραμματέας του Συμβουλίου Ασφαλείας της Ρωσίας ο Νικολάι Πατρούσεφ.
'Οι δραστηριότητες των αμερικανικών βιολογικών εργαστηρίων είναι γεμάτες με θανάσιμη απειλή για έναν τεράστιο αριθμό αμάχων' επανήλθε στο φλέγον θέμα ο Λαβρόφ.",katohika.gr,329439,news,GR,el,['Κατοχικά Νέα'],https://katohika.gr/wp-content/uploads/2022/03/kinezos-1.jpg,False,@katohikanea,29.786106,8c72cb6c6ccfcfc545b21ef9a3ac8e88
Πόλεμος στην Ουκρανία: Πρώτη επίσημη επαφή μεταξύ υψηλόβαθμων αξιωματούχων ΗΠΑ και Ρωσίας,Tο Ποντίκι Web,2022-03-16 15:23:26,full,https://www.topontiki.gr/2022/03/16/polemos-stin-oukrania-proti-episimi-epafi-metaxi-ipsilovathmon-axiomatouchon-ipa-ke-rosias,topontiki.gr,"Ήταν η πρώτη επίσημη επαφή υψηλού επιπέδου μεταξύ αξιωματούχων των ΗΠΑ και της Ρωσίας μετά την εισβολή στην Ουκρανία, στις 24 Φεβρουαρίου","Ο σύμβουλος Εθνικής Ασφάλειας του Λευκού Οίκου Τζέικ Σάλιβαν μίλησε σήμερα με τον Νικολάι Πατρούσεφ, τον γραμματέα του Συμβουλίου Ασφαλείας της Ρωσίας και τον προειδοποίησε για τις συνέπειες που θα είχε «τυχόν απόφαση του Κρεμλίνου να χρησιμοποιήσει χημικά ή βιολογικά όπλα στην Ουκρανία».
Αυτή ήταν η πρώτη επίσημη επαφή υψηλού επιπέδου μεταξύ αξιωματούχων των ΗΠΑ και της Ρωσίας μετά την εισβολή στην Ουκρανία, στις 24 Φεβρουαρίου.
Σύμφωνα με τον Λευκό Οίκο, ο Σάλιβαν είπε στον στρατηγό Πατρούσεφ ότι «αν η Ρωσία σοβαρολογεί στο θέμα της διπλωματίας, τότε πρέπει να σταματήσει τις επιθέσεις στις ουκρανικές πόλεις».",topontiki.gr,88862,news,GR,el,['Tο Ποντίκι Web'],https://www.topontiki.gr/wp-content/uploads/2022/03/us-russia-new.jpg,False,@topontiki,26.68102,8bf4307009b8d39e719dce62a2fda72c
Προειδοποίηση Ουάσινγκτον σε Μόσχα: Μην χρησιμοποιήσετε χημικά ή βιολογικά όπλα στην Ουκρανία,The Lifo Team,2022-03-16 21:05:58,full,https://www.lifo.gr/now/world/proeidopoiisi-oyasingkton-se-mosha-min-hrisimopoiisete-himika-i-biologika-opla-stin,lifo.gr,Συνομιλία των συμβούλων Εθνικής Ασφάλειας των δύο χωρών,"Συνομιλία των συμβούλων Εθνικής Ασφάλειας των δύο χωρών Η Ουάσινγκτον προειδοποίησε τη Μόσχα να μην χρησιμοποιήσει χημικά ή βιολογικά όπλα στον πόλεμο στην Ουκρανία. Ο σύμβουλος Εθνικής Ασφάλειας του Λευκού Οίκου, σε επικοινωνία με τον Ρώσο ομόλογό του, Νικολάι Πατρούσεφ, προειδοποίησε για τις συνέπειες και τις επιπλοκές «όποιας πιθανής απόφασης της Μόσχας να χρησιμοποιήσει χημικά ή βιολογικά όπλα στην Ουκρανία». Η προειδοποίηση αυτή αποτυπώνει τις εντεινόμενες ανησυχίες στην Ουάσινγκτον ότι οι Ρώσοι, μπορεί να καταφύγουν σε όπλα μαζικής καταστροφής.",lifo.gr,26378,world,GR,el,['The Lifo Team'],https://www.lifo.gr/sites/default/files/styles/facebook_with_logo/public/articles/2022-03-16/kiev.jpg?itok=V7oTpjvx,False,@lifomag,27.474176,a51a98d518d87866b764749a1f886dd5
Πόλεμος στην Ουκρανία / Βρήκαμε νέα πειστήρια εμπλοκής των ΗΠΑ σε στρατιωτικά βιολογικά πειράματα λένε οι Ρώσοι,Θανάσης Καρτερός,2022-03-18 08:31:06,full,https://www.avgi.gr/diethni/410514_brikame-nea-peistiria-emplokis-ton-ipa-se-stratiotika-biologika-peiramata-lene-oi,avgi.gr,Έκτακτη συνεδρίαση του Συμβουλίου Ασφαλείας ζητά η Μόσχα - Κατά το Tass βρέθηκαν περισσότερα ντοκουμέντα για αμερικανική εμπλοκή σε έρευνες για βιολογικά όπλα,ΠΟΛΙΤΙΚΗΟΙΚΟΝΟΜΙΑΚΟΙΝΩΝΙΑΔΙΕΘΝΗΤΕΧΝΕΣΑΘΛΗΤΙΚΑΕΝΘΕΤΑVIVEREΓΝΩΜΕΣ Αυγή Newsroom Twitter Έκτακτη συνεδρίαση του Συμβουλίου Ασφαλείας ζητά η Μόσχα - Κατά το Tass βρέθηκαν περισσότερα ντοκουμέντα για αμερικανική εμπλοκή σε έρευνες για βιολογικά όπλαΣε ανάρτησή του το ρωσικό πρακτορείο ειδήσεων TASS αναφέρει την Παρασκευή ότι οι ρωσικές δυνάμεις που επιχειρούν στην Ουκρανία εντόπισαν νέα ντοκουμέντα και πειστήρια που επιβεβαιώνουν ότι το αμερικανικό Πεντάγωνο εμπλέκεται στη χρηματοδότηση στρατιωτικών βιολογικών πρότζεκτ στην χώρα.,avgi.gr,60193,news,GR,el,"['Θανάσης Καρτερός', 'Πέτρος Κατσάκος', 'Όλγα Στέφου', 'Ανδρέας Πετρόπουλος']",https://www.avgi.gr/sites/default/files/styles/og_image/public/2022-03/nebeznya.jpg?itok=uJQrdk9J,False,@AvgiOnline,27.341824,1d149a6d7525447e6ac2402b1bd10b23
"Πούτιν: Έτσι θα σταματήσει ο πόλεμος, οι ΗΠΑ στήριξαν δημιουργία βιολογικών όπλων στην Ουκρανία",Newsroom,2022-03-18 09:11:23,full,https://www.newsbomb.gr/kosmos/story/1294741/poytin-etsi-tha-stamatisei-o-polemos-oi-hpa-stirixan-dimioyrgia-viologikon-oplon-stin-oykrania,newsbomb.gr,Ο Βλαντιμίρ Πούτιν περιέγραψε στον Ρετζέπ Ταγίπ Ερντογάν τι ζητά η Ρωσία για να σταματήσει ο πόλεμος στην Ουκρανία,"Ο Βλαντιμίρ Πούτιν περιέγραψε στον Ρετζέπ Ταγίπ Ερντογάν τι ζητά η Ρωσία για να σταματήσει ο πόλεμος στην Ουκρανία AP PHOTO Ο Βλαντιμίρ Πούτιν περιέγραψε στον Ρετζέπ Ταγίπ Ερντογάν τι ζητά η Ρωσία για να σταματήσει ο πόλεμος στην Ουκρανία - Επιμένει και για τα βιολογικά εργαστήρια στην Ουκρανία Τις θέσεις της Ρωσίας προκειμένου να μπει ένα τέλος στον πόλεμο στην Ουκρανία αποκάλυψε στο BBC ο σύμβουλος του Τούρκου προέδρου, Ιμπραήμ Καλίν, μετά την τηλεφωνική επικοινωνία που είχαν την Πέμπτη ο Βλαντιμίρ Πούτιν με τον Ρετζέπ Ταγίπ Ερντογάν.",newsbomb.gr,32083,news,GR,el,['Newsroom'],https://nb.bbend.net/media/news/2022/03/18/1294741/facebook/facebookputin-rosia.jpg,False,@newsbombgr,29.384287,8fab1ccece0fb858b80e98946754f28e
Μόσχα: Βρήκαμε νέα πειστήρια εμπλοκής των ΗΠΑ σε στρατιωτικά βιολογικά πειράματα στην Ουκρανία,Newsroom,2022-03-18 10:14:28,full,https://www.documentonews.gr/article/mosxa-vrikame-nea-peistiria-emplokis-ton-hpa-se-stratiotika-viologika-peiramata-stin-oykrania,documentonews.gr,"Έκτακτη συνεδρίαση του Συμβουλίου Ασφαλείας ζητά η Μόσχα, καθώς σύμφωνα με το επίσημο ρωσικό πρακτορείο Tass βρέθηκαν περισσότερα στοιχεία στην Ουκρανία για αμερικανική εμπλοκή σε έρευνες για…","Έκτακτη συνεδρίαση του Συμβουλίου Ασφαλείας ζητά η Μόσχα, καθώς σύμφωνα με το επίσημο ρωσικό πρακτορείο Tass βρέθηκαν περισσότερα στοιχεία στην Ουκρανία για αμερικανική εμπλοκή σε έρευνες για βιολογικά όπλα.
Σε ανάρτησή του το ρωσικό πρακτορείο ειδήσεων TASS αναφέρει ότι οι ρωσικές δυνάμεις που επιχειρούν στην Ουκρανία εντόπισαν νέα στοιχεία και πειστήρια που επιβεβαιώνουν ότι το αμερικανικό Πεντάγωνο εμπλέκεται στη χρηματοδότηση στρατιωτικών βιολογικών πρότζεκτ στην χώρα.
«Στελέχη αυτών των βιολογικών όπλων δημιουργήθηκαν στην Ουκρανία», είπε ο επικεφαλής της ρωσικής υπηρεσίας προστασίας από ραδιολογικές, χημικές και βιολογικές απειλές, Ίγκορ Κιρίλοφ, ο οποίος επέδειξε έγγραφο που φέρεται να επιβεβαιώνει «άμεση εμπλοκή του Πενταγώνου στην χρηματοδότηση στρατιωτικών βιολογικών πρότζεκτ στην Ουκρανία», με ημερομηνία 6 Μαρτίου 2015.",documentonews.gr,175110,news,GR,el,[],https://www.documentonews.gr/wp-content/uploads/2022/03/rusia_united_nations.jpg,False,@documentonews,27.37871,de60bb42717f9f71fa62e7a5ad59ecca
Δημοσιογράφος πετάχτηκε έξω ρωτώντας για τα βιολογικά εργαστήρια στην Ουκρανία,iskra,2022-03-19 07:56:33,full,https://iskra.gr/dimosiografos-petachtike-exo-rotontas-gia-ta-viologika-ergastiria-stin-oukrania,iskra.gr,Η Dilyana Gaytandzhieva είναι μία μαχητική δημοσιογράφος η οποία 4 χρόνια πριν «εκτοξεύτηκε» έξω από το Ευρωκοινοβούλιο όταν έκανε «ακατάλληλες» ερωτήσεις για τα αμερικανικά βιολογικά εργαστήρια στην…,"Η Dilyana Gaytandzhieva είναι μία μαχητική δημοσιογράφος η οποία 4 χρόνια πριν «εκτοξεύτηκε» έξω από το Ευρωκοινοβούλιο όταν έκανε «ακατάλληλες» ερωτήσεις για τα αμερικανικά βιολογικά εργαστήρια στην Ουκρανία.
Μάλιστα τα αμερικανικά ΜΜΕ έλεγαν πως διαδίδει «fake news».
Έτσι δουλεύει η «Δημοκρατία». Μόνο ότι μας συμφέρει διαδίδεται. ΕΤΙΚΕΤΕΣΒΙΟΛΟΓΙΚΑ ΕΡΓΑΣΤΗΡΙΑΔΗΜΟΣΙΟΓΡΑΦΟΣΗΠΑΟΥΚΡΑΝΙΑ",iskra.gr,381545,news,GR,el,['iskra'],https://iskra.gr/wp-content/uploads/2022/03/372740813.jpg,False,@iskranews,28.431976,1eaf827c5e6c89b066bb5ff0eeaa5c65
